{
  "schemaVersion": 1,
  "id": "__ID__",
  "name": "__NAME__",
  "version": "1.0.0",
  "description": "__DESCRIPTION__",
  "developer": {
    "name": "__DEVELOPER__"
  },
  "license": "MIT",
  "sdk": {
    "version": 1,
    "permissions": []
  },
  "main": "index.js",
  "lang": {
    "en": "lang/en.json",
    "de": "lang/de.json"
  }
}
